{
  "id": "pallets-flask-5063",
  "title": "SWE-bench Lite pallets__flask-5063",
  "prompt": "Flask routes to return domain/sub-domains information\nCurrently when checking **flask routes** it provides all routes but **it is no way to see which routes are assigned to which subdomain**.\r\n\r\n**Default server name:**\r\nSERVER_NAME: 'test.local'\r\n\r\n**Domains (sub-domains):**\r\ntest.test.local\r\nadmin.test.local\r\ntest.local\r\n\r\n**Adding blueprints:**\r\napp.register_blueprint(admin_blueprint,url_prefix='',subdomain='admin')\r\napp.register_blueprint(test_subdomain_blueprint,url_prefix='',subdomain='test')\r\n\r\n\r\n```\r\n$ flask routes\r\n * Tip: There are .env or .flaskenv files present. Do \"pip install python-dotenv\" to use them.\r\nEndpoint                                                 Methods    Rule\r\n-------------------------------------------------------  ---------  ------------------------------------------------\r\nadmin_blueprint.home                                      GET        /home\r\ntest_subdomain_blueprint.home                             GET        /home\r\nstatic                                                    GET        /static/<path:filename>\r\n...\r\n```\r\n\r\n\r\n**Feature request**\r\nIt will be good to see something like below (that will make more clear which route for which subdomain, because now need to go and check configuration).\r\n**If it is not possible to fix routes**, can you add or tell which method(s) should be used to get below information from flask? \r\n\r\n```\r\n$ flask routes\r\n * Tip: There are .env or .flaskenv files present. Do \"pip install python-dotenv\" to use them.\r\nDomain                Endpoint                                             Methods    Rule\r\n-----------------   ----------------------------------------------------  ----------  ------------------------------------------------\r\nadmin.test.local     admin_blueprint.home                                  GET        /home\r\ntest.test.local      test_subdomain_blueprint.home                         GET        /home\r\ntest.local           static                                                GET        /static/<path:filename>\r\n...\r\n```",
  "source": {
    "git": "https://github.com/pallets/flask.git",
    "revision": "182ce3dd15dfa3537391c3efaf9c3ff407d134d4"
  },
  "baseline_patch": "diff --git a/tests/test_cli.py b/tests/test_cli.py\n--- a/tests/test_cli.py\n+++ b/tests/test_cli.py\n@@ -433,16 +433,12 @@ class TestRoutes:\n     @pytest.fixture\n     def app(self):\n         app = Flask(__name__)\n-        app.testing = True\n-\n-        @app.route(\"/get_post/<int:x>/<int:y>\", methods=[\"GET\", \"POST\"])\n-        def yyy_get_post(x, y):\n-            pass\n-\n-        @app.route(\"/zzz_post\", methods=[\"POST\"])\n-        def aaa_post():\n-            pass\n-\n+        app.add_url_rule(\n+            \"/get_post/<int:x>/<int:y>\",\n+            methods=[\"GET\", \"POST\"],\n+            endpoint=\"yyy_get_post\",\n+        )\n+        app.add_url_rule(\"/zzz_post\", methods=[\"POST\"], endpoint=\"aaa_post\")\n         return app\n \n     @pytest.fixture\n@@ -450,17 +446,6 @@ def invoke(self, app, runner):\n         cli = FlaskGroup(create_app=lambda: app)\n         return partial(runner.invoke, cli)\n \n-    @pytest.fixture\n-    def invoke_no_routes(self, runner):\n-        def create_app():\n-            app = Flask(__name__, static_folder=None)\n-            app.testing = True\n-\n-            return app\n-\n-        cli = FlaskGroup(create_app=create_app)\n-        return partial(runner.invoke, cli)\n-\n     def expect_order(self, order, output):\n         # skip the header and match the start of each row\n         for expect, line in zip(order, output.splitlines()[2:]):\n@@ -493,11 +478,31 @@ def test_all_methods(self, invoke):\n         output = invoke([\"routes\", \"--all-methods\"]).output\n         assert \"GET, HEAD, OPTIONS, POST\" in output\n \n-    def test_no_routes(self, invoke_no_routes):\n-        result = invoke_no_routes([\"routes\"])\n+    def test_no_routes(self, runner):\n+        app = Flask(__name__, static_folder=None)\n+        cli = FlaskGroup(create_app=lambda: app)\n+        result = runner.invoke(cli, [\"routes\"])\n         assert result.exit_code == 0\n         assert \"No routes were registered.\" in result.output\n \n+    def test_subdomain(self, runner):\n+        app = Flask(__name__, static_folder=None)\n+        app.add_url_rule(\"/a\", subdomain=\"a\", endpoint=\"a\")\n+        app.add_url_rule(\"/b\", subdomain=\"b\", endpoint=\"b\")\n+        cli = FlaskGroup(create_app=lambda: app)\n+        result = runner.invoke(cli, [\"routes\"])\n+        assert result.exit_code == 0\n+        assert \"Subdomain\" in result.output\n+\n+    def test_host(self, runner):\n+        app = Flask(__name__, static_folder=None, host_matching=True)\n+        app.add_url_rule(\"/a\", host=\"a\", endpoint=\"a\")\n+        app.add_url_rule(\"/b\", host=\"b\", endpoint=\"b\")\n+        cli = FlaskGroup(create_app=lambda: app)\n+        result = runner.invoke(cli, [\"routes\"])\n+        assert result.exit_code == 0\n+        assert \"Host\" in result.output\n+\n \n def dotenv_not_available():\n     try:\n",
  "env": {
    "PYTHONUTF8": "1",
    "PYTHONIOENCODING": "utf-8",
    "PYTHONDONTWRITEBYTECODE": "1"
  },
  "setup": [
    {
      "name": "install pinned repository",
      "argv": [
        "python",
        "-m",
        "pip",
        "install",
        "-e",
        "."
      ],
      "timeout_seconds": 1200
    }
  ],
  "baseline": [
    {
      "name": "prove SWE-bench regression",
      "argv": [
        "python",
        "-m",
        "pytest",
        "-q",
        "tests/test_cli.py::TestRoutes::test_subdomain",
        "tests/test_cli.py::TestRoutes::test_host"
      ],
      "timeout_seconds": 900
    }
  ],
  "judges": [
    {
      "name": "SWE-bench FAIL_TO_PASS",
      "argv": [
        "python",
        "-m",
        "pytest",
        "-q",
        "tests/test_cli.py::TestRoutes::test_subdomain",
        "tests/test_cli.py::TestRoutes::test_host"
      ],
      "timeout_seconds": 900
    },
    {
      "name": "SWE-bench PASS_TO_PASS regression sample",
      "argv": [
        "python",
        "-m",
        "pytest",
        "-q",
        "tests/test_cli.py::test_cli_name",
        "tests/test_cli.py::test_find_best_app",
        "tests/test_cli.py::test_prepare_import",
        "tests/test_cli.py::test_locate_app",
        "tests/test_cli.py::test_locate_app_raises",
        "tests/test_cli.py::test_locate_app_suppress_raise",
        "tests/test_cli.py::test_get_version",
        "tests/test_cli.py::test_scriptinfo",
        "tests/test_cli.py::test_app_cli_has_app_context",
        "tests/test_cli.py::test_with_appcontext",
        "tests/test_cli.py::test_appgroup_app_context",
        "tests/test_cli.py::test_flaskgroup_app_context",
        "tests/test_cli.py::test_flaskgroup_debug",
        "tests/test_cli.py::test_flaskgroup_nested",
        "tests/test_cli.py::test_no_command_echo_loading_error",
        "tests/test_cli.py::test_help_echo_loading_error",
        "tests/test_cli.py::test_help_echo_exception",
        "tests/test_cli.py::TestRoutes::test_simple",
        "tests/test_cli.py::TestRoutes::test_sort",
        "tests/test_cli.py::TestRoutes::test_all_methods"
      ],
      "timeout_seconds": 1200
    }
  ],
  "forbidden_changes": [
    "tests/test_cli.py"
  ],
  "agent_verify_command": "python -m pytest -q tests/test_cli.py::TestRoutes::test_subdomain tests/test_cli.py::TestRoutes::test_host",
  "agent_verify_timeout_seconds": 900,
  "agent_timeout_seconds": 2400,
  "seeds": [
    11,
    29,
    47
  ],
  "minimum_pass_rate": 0.6666666666666666,
  "tags": [
    "swe-bench-lite",
    "real-repository",
    "pallets/flask",
    "fixed-revision"
  ]
}
