{
  "id": "pytest-dev-pytest-9359",
  "title": "SWE-bench Lite pytest-dev__pytest-9359",
  "prompt": "Error message prints extra code line when using assert in python3.9\n<!--\r\nThanks for submitting an issue!\r\n\r\nQuick check-list while reporting bugs:\r\n-->\r\n\r\n- [x] a detailed description of the bug or problem you are having\r\n- [x] output of `pip list` from the virtual environment you are using\r\n- [x] pytest and operating system versions\r\n- [ ] minimal example if possible\r\n### Description\r\nI have a test like this:\r\n```\r\nfrom pytest import fixture\r\n\r\n\r\ndef t(foo):\r\n    return foo\r\n\r\n\r\n@fixture\r\ndef foo():\r\n    return 1\r\n\r\n\r\ndef test_right_statement(foo):\r\n    assert foo == (3 + 2) * (6 + 9)\r\n\r\n    @t\r\n    def inner():\r\n        return 2\r\n\r\n    assert 2 == inner\r\n\r\n\r\n@t\r\ndef outer():\r\n    return 2\r\n```\r\nThe test \"test_right_statement\" fails at the first assertion,but print extra code (the \"t\" decorator) in error details, like this:\r\n\r\n```\r\n ============================= test session starts =============================\r\nplatform win32 -- Python 3.9.6, pytest-6.2.5, py-1.10.0, pluggy-0.13.1 -- \r\ncachedir: .pytest_cache\r\nrootdir: \r\nplugins: allure-pytest-2.9.45\r\ncollecting ... collected 1 item\r\n\r\ntest_statement.py::test_right_statement FAILED                           [100%]\r\n\r\n================================== FAILURES ===================================\r\n____________________________ test_right_statement _____________________________\r\n\r\nfoo = 1\r\n\r\n    def test_right_statement(foo):\r\n>       assert foo == (3 + 2) * (6 + 9)\r\n    \r\n        @t\r\nE       assert 1 == 75\r\nE         +1\r\nE         -75\r\n\r\ntest_statement.py:14: AssertionError\r\n=========================== short test summary info ===========================\r\nFAILED test_statement.py::test_right_statement - assert 1 == 75\r\n============================== 1 failed in 0.12s ==============================\r\n```\r\nAnd the same thing **did not** happen when using python3.7.10：\r\n```\r\n============================= test session starts =============================\r\nplatform win32 -- Python 3.7.10, pytest-6.2.5, py-1.11.0, pluggy-1.0.0 -- \r\ncachedir: .pytest_cache\r\nrootdir: \r\ncollecting ... collected 1 item\r\n\r\ntest_statement.py::test_right_statement FAILED                           [100%]\r\n\r\n================================== FAILURES ===================================\r\n____________________________ test_right_statement _____________________________\r\n\r\nfoo = 1\r\n\r\n    def test_right_statement(foo):\r\n>       assert foo == (3 + 2) * (6 + 9)\r\nE       assert 1 == 75\r\nE         +1\r\nE         -75\r\n\r\ntest_statement.py:14: AssertionError\r\n=========================== short test summary info ===========================\r\nFAILED test_statement.py::test_right_statement - assert 1 == 75\r\n============================== 1 failed in 0.03s ==============================\r\n```\r\nIs there some problems when calculate the statement lineno?\r\n\r\n### pip list \r\n```\r\n$ pip list\r\nPackage            Version\r\n------------------ -------\r\natomicwrites       1.4.0\r\nattrs              21.2.0\r\ncolorama           0.4.4\r\nimportlib-metadata 4.8.2\r\niniconfig          1.1.1\r\npackaging          21.3\r\npip                21.3.1\r\npluggy             1.0.0\r\npy                 1.11.0\r\npyparsing          3.0.6\r\npytest             6.2.5\r\nsetuptools         59.4.0\r\ntoml               0.10.2\r\ntyping_extensions  4.0.0\r\nzipp               3.6.0\r\n\r\n```\r\n### pytest and operating system versions\r\npytest 6.2.5\r\nWindows 10 \r\nSeems to happen in python 3.9,not 3.7",
  "source": {
    "git": "https://github.com/pytest-dev/pytest.git",
    "revision": "e2ee3144ed6e241dea8d96215fcdca18b3892551"
  },
  "baseline_patch": "diff --git a/testing/code/test_source.py b/testing/code/test_source.py\n--- a/testing/code/test_source.py\n+++ b/testing/code/test_source.py\n@@ -618,6 +618,19 @@ def something():\n     assert str(source) == \"def func(): raise ValueError(42)\"\n \n \n+def test_decorator() -> None:\n+    s = \"\"\"\\\n+def foo(f):\n+    pass\n+\n+@foo\n+def bar():\n+    pass\n+    \"\"\"\n+    source = getstatement(3, s)\n+    assert \"@foo\" in str(source)\n+\n+\n def XXX_test_expression_multiline() -> None:\n     source = \"\"\"\\\n something\n",
  "env": {
    "PYTHONUTF8": "1",
    "PYTHONIOENCODING": "utf-8",
    "PYTHONDONTWRITEBYTECODE": "1"
  },
  "setup": [
    {
      "name": "install pinned repository",
      "argv": [
        "python",
        "-m",
        "pip",
        "install",
        "-e",
        "."
      ],
      "timeout_seconds": 1200
    }
  ],
  "baseline": [
    {
      "name": "prove SWE-bench regression",
      "argv": [
        "python",
        "-m",
        "pytest",
        "-q",
        "testing/code/test_source.py::test_decorator"
      ],
      "timeout_seconds": 900
    }
  ],
  "judges": [
    {
      "name": "SWE-bench FAIL_TO_PASS",
      "argv": [
        "python",
        "-m",
        "pytest",
        "-q",
        "testing/code/test_source.py::test_decorator"
      ],
      "timeout_seconds": 900
    },
    {
      "name": "SWE-bench PASS_TO_PASS regression sample",
      "argv": [
        "python",
        "-m",
        "pytest",
        "-q",
        "testing/code/test_source.py::test_source_str_function",
        "testing/code/test_source.py::test_source_from_function",
        "testing/code/test_source.py::test_source_from_method",
        "testing/code/test_source.py::test_source_from_lines",
        "testing/code/test_source.py::test_source_from_inner_function",
        "testing/code/test_source.py::test_source_strips",
        "testing/code/test_source.py::test_source_strip_multiline",
        "testing/code/test_source.py::TestAccesses::test_getrange",
        "testing/code/test_source.py::TestAccesses::test_getrange_step_not_supported",
        "testing/code/test_source.py::TestAccesses::test_getline",
        "testing/code/test_source.py::TestAccesses::test_len",
        "testing/code/test_source.py::TestAccesses::test_iter",
        "testing/code/test_source.py::TestSourceParsing::test_getstatement",
        "testing/code/test_source.py::TestSourceParsing::test_getstatementrange_triple_quoted",
        "testing/code/test_source.py::TestSourceParsing::test_getstatementrange_within_constructs",
        "testing/code/test_source.py::TestSourceParsing::test_getstatementrange_bug",
        "testing/code/test_source.py::TestSourceParsing::test_getstatementrange_bug2",
        "testing/code/test_source.py::TestSourceParsing::test_getstatementrange_ast_issue58",
        "testing/code/test_source.py::TestSourceParsing::test_getstatementrange_out_of_bounds_py3",
        "testing/code/test_source.py::TestSourceParsing::test_getstatementrange_with_syntaxerror_issue7"
      ],
      "timeout_seconds": 1200
    }
  ],
  "forbidden_changes": [
    "testing/code/test_source.py"
  ],
  "agent_verify_command": "python -m pytest -q testing/code/test_source.py::test_decorator",
  "agent_verify_timeout_seconds": 900,
  "agent_timeout_seconds": 2400,
  "seeds": [
    11,
    29,
    47
  ],
  "minimum_pass_rate": 0.6666666666666666,
  "tags": [
    "swe-bench-lite",
    "real-repository",
    "pytest-dev/pytest",
    "fixed-revision"
  ]
}
