{
  "id": "swebench-django-11019-multiagent",
  "title": "Django three-way Media ordering with parallel investigation",
  "prompt": "Fix Django's Media merging so combining three or more media objects preserves only real per-list ordering constraints, deduplicates assets, and warns only for genuine cycles. Before editing, launch at least two independent read-only subagents concurrently: one must trace the current Media merge/add behavior and root cause, while the other must inspect the repository's topological-sort utilities and identify compatibility/regression risks in the updated tests. You may use parallel_tasks or multiple task calls in the same model turn; actual concurrent execution is required. Collect and use both results. After that initial research, use the parent's read/search/edit/command tools directly. The parent agent must make the production change and run the relevant tests. Do not modify tests or delegate the final edit, and do not launch more than four subagents.",
  "source": "../../artifacts/eval-sources/django-11019",
  "env": {
    "PYTHONPATH": ".",
    "PYTHONUTF8": "1",
    "PYTHONIOENCODING": "utf-8"
  },
  "baseline": [
    {
      "name": "prove three-way Media ordering regression",
      "argv": ["python", "tests/runtests.py", "forms_tests.tests.test_media", "--verbosity", "0"],
      "timeout_seconds": 300
    }
  ],
  "judges": [
    {
      "name": "official Media regression module",
      "argv": ["python", "tests/runtests.py", "forms_tests.tests.test_media", "--verbosity", "0"],
      "timeout_seconds": 300
    },
    {
      "name": "cross-app Media regressions",
      "argv": ["python", "tests/runtests.py", "admin_widgets.test_autocomplete_widget.AutocompleteMixinTests.test_media", "admin_inlines.tests.TestInlineMedia.test_inline_media_only_inline", "--verbosity", "0"],
      "timeout_seconds": 300
    },
    {
      "name": "forms regression suite",
      "argv": ["python", "tests/runtests.py", "forms_tests", "--verbosity", "0"],
      "timeout_seconds": 900
    },
    {
      "name": "widgets compiler check",
      "argv": ["python", "-m", "py_compile", "django/forms/widgets.py"],
      "timeout_seconds": 60
    }
  ],
  "forbidden_changes": ["tests/**"],
  "agent_verify_command": "python tests/runtests.py forms_tests.tests.test_media --verbosity 0",
  "agent_verify_timeout_seconds": 300,
  "agent_min_subagents": 2,
  "agent_min_parallel_subagents": 2,
  "agent_max_subagents": 4,
  "agent_timeout_seconds": 1800
}
