{
  "id": "swebench-django-11001",
  "title": "Django multiline RawSQL order_by deduplication",
  "prompt": "Fix the reported Django SQLCompiler bug where distinct multiline RawSQL order_by expressions can be incorrectly treated as duplicates because only their final line is compared. Preserve legitimate duplicate elimination and support both normal and distinct querysets. Inspect the repository, implement the production fix, and run the relevant tests. Do not modify tests.",
  "source": "../../artifacts/eval-sources/django-11001",
  "env": {
    "PYTHONPATH": ".",
    "PYTHONUTF8": "1",
    "PYTHONIOENCODING": "utf-8"
  },
  "baseline": [
    {
      "name": "prove multiline RawSQL regression",
      "argv": ["python", "tests/runtests.py", "expressions.tests.BasicExpressionsTests.test_order_by_multiline_sql", "--verbosity", "0"],
      "timeout_seconds": 300,
      "expected_exit_codes": [0]
    }
  ],
  "judges": [
    {
      "name": "targeted regression",
      "argv": ["python", "tests/runtests.py", "expressions.tests.BasicExpressionsTests.test_order_by_multiline_sql", "--verbosity", "0"],
      "timeout_seconds": 300
    },
    {
      "name": "expressions regression module",
      "argv": ["python", "tests/runtests.py", "expressions", "--verbosity", "0"],
      "timeout_seconds": 900
    },
    {
      "name": "compiler check",
      "argv": ["python", "-m", "py_compile", "django/db/models/sql/compiler.py"],
      "timeout_seconds": 60
    }
  ],
  "forbidden_changes": ["tests/**"],
  "agent_verify_command": "python tests/runtests.py expressions.tests.BasicExpressionsTests.test_order_by_multiline_sql --verbosity 0",
  "agent_verify_timeout_seconds": 300,
  "agent_timeout_seconds": 1800
}
