{
  "id": "pallets-flask-4992",
  "title": "SWE-bench Lite pallets__flask-4992",
  "prompt": "Add a file mode parameter to flask.Config.from_file()\nPython 3.11 introduced native TOML support with the `tomllib` package. This could work nicely with the `flask.Config.from_file()` method as an easy way to load TOML config files:\r\n\r\n```python\r\napp.config.from_file(\"config.toml\", tomllib.load)\r\n```\r\n\r\nHowever, `tomllib.load()` takes an object readable in binary mode, while `flask.Config.from_file()` opens a file in text mode, resulting in this error:\r\n\r\n```\r\nTypeError: File must be opened in binary mode, e.g. use `open('foo.toml', 'rb')`\r\n```\r\n\r\nWe can get around this with a more verbose expression, like loading from a file opened with the built-in `open()` function and passing the `dict` to `app.Config.from_mapping()`:\r\n\r\n```python\r\n# We have to repeat the path joining that from_file() does\r\nwith open(os.path.join(app.config.root_path, \"config.toml\"), \"rb\") as file:\r\n    app.config.from_mapping(tomllib.load(file))\r\n```\r\n\r\nBut adding a file mode parameter to `flask.Config.from_file()` would enable the use of a simpler expression. E.g.:\r\n\r\n```python\r\napp.config.from_file(\"config.toml\", tomllib.load, mode=\"b\")\r\n```",
  "source": {
    "git": "https://github.com/pallets/flask.git",
    "revision": "4c288bc97ea371817199908d0d9b12de9dae327e"
  },
  "baseline_patch": "diff --git a/tests/static/config.toml b/tests/static/config.toml\nnew file mode 100644\n--- /dev/null\n+++ b/tests/static/config.toml\n@@ -0,0 +1,2 @@\n+TEST_KEY=\"foo\"\n+SECRET_KEY=\"config\"\ndiff --git a/tests/test_config.py b/tests/test_config.py\n--- a/tests/test_config.py\n+++ b/tests/test_config.py\n@@ -6,7 +6,6 @@\n \n import flask\n \n-\n # config keys used for the TestConfig\n TEST_KEY = \"foo\"\n SECRET_KEY = \"config\"\n@@ -30,13 +29,23 @@ def test_config_from_object():\n     common_object_test(app)\n \n \n-def test_config_from_file():\n+def test_config_from_file_json():\n     app = flask.Flask(__name__)\n     current_dir = os.path.dirname(os.path.abspath(__file__))\n     app.config.from_file(os.path.join(current_dir, \"static\", \"config.json\"), json.load)\n     common_object_test(app)\n \n \n+def test_config_from_file_toml():\n+    tomllib = pytest.importorskip(\"tomllib\", reason=\"tomllib added in 3.11\")\n+    app = flask.Flask(__name__)\n+    current_dir = os.path.dirname(os.path.abspath(__file__))\n+    app.config.from_file(\n+        os.path.join(current_dir, \"static\", \"config.toml\"), tomllib.load, text=False\n+    )\n+    common_object_test(app)\n+\n+\n def test_from_prefixed_env(monkeypatch):\n     monkeypatch.setenv(\"FLASK_STRING\", \"value\")\n     monkeypatch.setenv(\"FLASK_BOOL\", \"true\")\n",
  "env": {
    "PYTHONUTF8": "1",
    "PYTHONIOENCODING": "utf-8",
    "PYTHONDONTWRITEBYTECODE": "1"
  },
  "setup": [
    {
      "name": "install pinned repository",
      "argv": [
        "python",
        "-m",
        "pip",
        "install",
        "-e",
        "."
      ],
      "timeout_seconds": 1200
    }
  ],
  "baseline": [
    {
      "name": "prove SWE-bench regression",
      "argv": [
        "python",
        "-m",
        "pytest",
        "-q",
        "tests/test_config.py::test_config_from_file_toml"
      ],
      "timeout_seconds": 900
    }
  ],
  "judges": [
    {
      "name": "SWE-bench FAIL_TO_PASS",
      "argv": [
        "python",
        "-m",
        "pytest",
        "-q",
        "tests/test_config.py::test_config_from_file_toml"
      ],
      "timeout_seconds": 900
    },
    {
      "name": "SWE-bench PASS_TO_PASS regression sample",
      "argv": [
        "python",
        "-m",
        "pytest",
        "-q",
        "tests/test_config.py::test_config_from_pyfile",
        "tests/test_config.py::test_config_from_object",
        "tests/test_config.py::test_config_from_file_json",
        "tests/test_config.py::test_from_prefixed_env",
        "tests/test_config.py::test_from_prefixed_env_custom_prefix",
        "tests/test_config.py::test_from_prefixed_env_nested",
        "tests/test_config.py::test_config_from_mapping",
        "tests/test_config.py::test_config_from_class",
        "tests/test_config.py::test_config_from_envvar",
        "tests/test_config.py::test_config_from_envvar_missing",
        "tests/test_config.py::test_config_missing",
        "tests/test_config.py::test_config_missing_file",
        "tests/test_config.py::test_custom_config_class",
        "tests/test_config.py::test_session_lifetime",
        "tests/test_config.py::test_get_namespace",
        "tests/test_config.py::test_from_pyfile_weird_encoding"
      ],
      "timeout_seconds": 1200
    }
  ],
  "forbidden_changes": [
    "tests/static/config.toml",
    "tests/test_config.py"
  ],
  "agent_verify_command": "python -m pytest -q tests/test_config.py::test_config_from_file_toml",
  "agent_verify_timeout_seconds": 900,
  "agent_timeout_seconds": 2400,
  "seeds": [
    11,
    29,
    47
  ],
  "minimum_pass_rate": 0.6666666666666666,
  "tags": [
    "swe-bench-lite",
    "real-repository",
    "pallets/flask",
    "fixed-revision"
  ]
}
