{
  "id": "swebench-pytest-11148",
  "title": "pytest importlib mode reuses previously imported modules",
  "prompt": "Fix pytest's import-mode=importlib behavior so importing the same module path again returns the module already registered under its derived module name instead of executing a second module object. The bug also appears when doctest collection and normal test imports touch the same package. Inspect the repository, implement the production fix, and run the relevant tests. Do not modify files under testing/. The local source package is available through PYTHONPATH=src.",
  "source": "../../artifacts/eval-sources/pytest-11148",
  "env": {
    "PYTHONPATH": "src",
    "PYTEST_DISABLE_PLUGIN_AUTOLOAD": "1",
    "PYTHONUTF8": "1",
    "PYTHONIOENCODING": "utf-8",
    "TEMP": "C:\\tmp\\minicode-swe-pytest",
    "TMP": "C:\\tmp\\minicode-swe-pytest"
  },
  "baseline": [
    {
      "name": "prove importlib duplicate module regression",
      "argv": ["python", "-m", "pytest", "testing/test_pathlib.py::TestImportPath::test_remembers_previous_imports", "testing/acceptance_test.py::test_doctest_and_normal_imports_with_importlib", "-q"],
      "timeout_seconds": 300
    }
  ],
  "judges": [
    {
      "name": "official importlib regression tests",
      "argv": ["python", "-m", "pytest", "testing/test_pathlib.py::TestImportPath::test_remembers_previous_imports", "testing/acceptance_test.py::test_doctest_and_normal_imports_with_importlib", "-q"],
      "timeout_seconds": 300
    },
    {
      "name": "complete pathlib regression module",
      "argv": ["python", "-m", "pytest", "testing/test_pathlib.py", "-q"],
      "timeout_seconds": 900
    },
    {
      "name": "acceptance importlib regressions",
      "argv": ["python", "-m", "pytest", "testing/acceptance_test.py", "-k", "importlib", "-q"],
      "timeout_seconds": 900
    },
    {
      "name": "pytest source compiler check",
      "argv": ["python", "-m", "compileall", "-q", "src/_pytest"],
      "timeout_seconds": 120
    }
  ],
  "forbidden_changes": ["testing/**"],
  "agent_verify_command": "python -m pytest testing/test_pathlib.py::TestImportPath::test_remembers_previous_imports testing/acceptance_test.py::test_doctest_and_normal_imports_with_importlib -q",
  "agent_verify_timeout_seconds": 300,
  "agent_timeout_seconds": 1800
}
