{
  "id": "pallets-flask-4045",
  "title": "SWE-bench Lite pallets__flask-4045",
  "prompt": "Raise error when blueprint name contains a dot\nThis is required since every dot is now significant since blueprints can be nested. An error was already added for endpoint names in 1.0, but should have been added for this as well.",
  "source": {
    "git": "https://github.com/pallets/flask.git",
    "revision": "d8c37f43724cd9fb0870f77877b7c4c7e38a19e0"
  },
  "baseline_patch": "diff --git a/tests/test_basic.py b/tests/test_basic.py\n--- a/tests/test_basic.py\n+++ b/tests/test_basic.py\n@@ -1631,7 +1631,7 @@ def something_else():\n \n \n def test_inject_blueprint_url_defaults(app):\n-    bp = flask.Blueprint(\"foo.bar.baz\", __name__, template_folder=\"template\")\n+    bp = flask.Blueprint(\"foo\", __name__, template_folder=\"template\")\n \n     @bp.url_defaults\n     def bp_defaults(endpoint, values):\n@@ -1644,12 +1644,12 @@ def view(page):\n     app.register_blueprint(bp)\n \n     values = dict()\n-    app.inject_url_defaults(\"foo.bar.baz.view\", values)\n+    app.inject_url_defaults(\"foo.view\", values)\n     expected = dict(page=\"login\")\n     assert values == expected\n \n     with app.test_request_context(\"/somepage\"):\n-        url = flask.url_for(\"foo.bar.baz.view\")\n+        url = flask.url_for(\"foo.view\")\n     expected = \"/login\"\n     assert url == expected\n \ndiff --git a/tests/test_blueprints.py b/tests/test_blueprints.py\n--- a/tests/test_blueprints.py\n+++ b/tests/test_blueprints.py\n@@ -1,5 +1,3 @@\n-import functools\n-\n import pytest\n from jinja2 import TemplateNotFound\n from werkzeug.http import parse_cache_control_header\n@@ -253,28 +251,9 @@ def test_templates_list(test_apps):\n     assert templates == [\"admin/index.html\", \"frontend/index.html\"]\n \n \n-def test_dotted_names(app, client):\n-    frontend = flask.Blueprint(\"myapp.frontend\", __name__)\n-    backend = flask.Blueprint(\"myapp.backend\", __name__)\n-\n-    @frontend.route(\"/fe\")\n-    def frontend_index():\n-        return flask.url_for(\"myapp.backend.backend_index\")\n-\n-    @frontend.route(\"/fe2\")\n-    def frontend_page2():\n-        return flask.url_for(\".frontend_index\")\n-\n-    @backend.route(\"/be\")\n-    def backend_index():\n-        return flask.url_for(\"myapp.frontend.frontend_index\")\n-\n-    app.register_blueprint(frontend)\n-    app.register_blueprint(backend)\n-\n-    assert client.get(\"/fe\").data.strip() == b\"/be\"\n-    assert client.get(\"/fe2\").data.strip() == b\"/fe\"\n-    assert client.get(\"/be\").data.strip() == b\"/fe\"\n+def test_dotted_name_not_allowed(app, client):\n+    with pytest.raises(ValueError):\n+        flask.Blueprint(\"app.ui\", __name__)\n \n \n def test_dotted_names_from_app(app, client):\n@@ -343,62 +322,19 @@ def index():\n def test_route_decorator_custom_endpoint_with_dots(app, client):\n     bp = flask.Blueprint(\"bp\", __name__)\n \n-    @bp.route(\"/foo\")\n-    def foo():\n-        return flask.request.endpoint\n-\n-    try:\n-\n-        @bp.route(\"/bar\", endpoint=\"bar.bar\")\n-        def foo_bar():\n-            return flask.request.endpoint\n-\n-    except AssertionError:\n-        pass\n-    else:\n-        raise AssertionError(\"expected AssertionError not raised\")\n-\n-    try:\n-\n-        @bp.route(\"/bar/123\", endpoint=\"bar.123\")\n-        def foo_bar_foo():\n-            return flask.request.endpoint\n-\n-    except AssertionError:\n-        pass\n-    else:\n-        raise AssertionError(\"expected AssertionError not raised\")\n-\n-    def foo_foo_foo():\n-        pass\n-\n-    pytest.raises(\n-        AssertionError,\n-        lambda: bp.add_url_rule(\"/bar/123\", endpoint=\"bar.123\", view_func=foo_foo_foo),\n-    )\n-\n-    pytest.raises(\n-        AssertionError, bp.route(\"/bar/123\", endpoint=\"bar.123\"), lambda: None\n-    )\n-\n-    foo_foo_foo.__name__ = \"bar.123\"\n+    with pytest.raises(ValueError):\n+        bp.route(\"/\", endpoint=\"a.b\")(lambda: \"\")\n \n-    pytest.raises(\n-        AssertionError, lambda: bp.add_url_rule(\"/bar/123\", view_func=foo_foo_foo)\n-    )\n+    with pytest.raises(ValueError):\n+        bp.add_url_rule(\"/\", endpoint=\"a.b\")\n \n-    bp.add_url_rule(\n-        \"/bar/456\", endpoint=\"foofoofoo\", view_func=functools.partial(foo_foo_foo)\n-    )\n+    def view():\n+        return \"\"\n \n-    app.register_blueprint(bp, url_prefix=\"/py\")\n+    view.__name__ = \"a.b\"\n \n-    assert client.get(\"/py/foo\").data == b\"bp.foo\"\n-    # The rule's didn't actually made it through\n-    rv = client.get(\"/py/bar\")\n-    assert rv.status_code == 404\n-    rv = client.get(\"/py/bar/123\")\n-    assert rv.status_code == 404\n+    with pytest.raises(ValueError):\n+        bp.add_url_rule(\"/\", view_func=view)\n \n \n def test_endpoint_decorator(app, client):\n",
  "env": {
    "PYTHONUTF8": "1",
    "PYTHONIOENCODING": "utf-8",
    "PYTHONDONTWRITEBYTECODE": "1"
  },
  "setup": [
    {
      "name": "install pinned repository",
      "argv": [
        "python",
        "-m",
        "pip",
        "install",
        "-e",
        "."
      ],
      "timeout_seconds": 1200
    }
  ],
  "baseline": [
    {
      "name": "prove SWE-bench regression",
      "argv": [
        "python",
        "-m",
        "pytest",
        "-q",
        "tests/test_blueprints.py::test_dotted_name_not_allowed",
        "tests/test_blueprints.py::test_route_decorator_custom_endpoint_with_dots"
      ],
      "timeout_seconds": 900
    }
  ],
  "judges": [
    {
      "name": "SWE-bench FAIL_TO_PASS",
      "argv": [
        "python",
        "-m",
        "pytest",
        "-q",
        "tests/test_blueprints.py::test_dotted_name_not_allowed",
        "tests/test_blueprints.py::test_route_decorator_custom_endpoint_with_dots"
      ],
      "timeout_seconds": 900
    },
    {
      "name": "SWE-bench PASS_TO_PASS regression sample",
      "argv": [
        "python",
        "-m",
        "pytest",
        "-q",
        "tests/test_basic.py::test_method_route_no_methods",
        "tests/test_basic.py::test_disallow_string_for_allowed_methods",
        "tests/test_basic.py::test_error_handler_unknown_code",
        "tests/test_basic.py::test_request_locals",
        "tests/test_basic.py::test_exception_propagation",
        "tests/test_basic.py::test_werkzeug_passthrough_errors",
        "tests/test_basic.py::test_get_method_on_g",
        "tests/test_basic.py::test_g_iteration_protocol",
        "tests/test_basic.py::test_run_defaults",
        "tests/test_basic.py::test_run_server_port",
        "tests/test_basic.py::test_run_from_config",
        "tests/test_basic.py::test_app_freed_on_zero_refcount",
        "tests/test_blueprints.py::test_template_filter",
        "tests/test_blueprints.py::test_add_template_filter",
        "tests/test_blueprints.py::test_template_filter_with_name",
        "tests/test_blueprints.py::test_add_template_filter_with_name",
        "tests/test_blueprints.py::test_template_test",
        "tests/test_blueprints.py::test_add_template_test",
        "tests/test_blueprints.py::test_template_test_with_name",
        "tests/test_blueprints.py::test_add_template_test_with_name"
      ],
      "timeout_seconds": 1200
    }
  ],
  "forbidden_changes": [
    "tests/test_basic.py",
    "tests/test_blueprints.py"
  ],
  "agent_verify_command": "python -m pytest -q tests/test_blueprints.py::test_dotted_name_not_allowed tests/test_blueprints.py::test_route_decorator_custom_endpoint_with_dots",
  "agent_verify_timeout_seconds": 900,
  "agent_timeout_seconds": 2400,
  "seeds": [
    11,
    29,
    47
  ],
  "minimum_pass_rate": 0.6666666666666666,
  "tags": [
    "swe-bench-lite",
    "real-repository",
    "pallets/flask",
    "fixed-revision"
  ]
}
