{
  "id": "pytest-dev-pytest-8365",
  "title": "SWE-bench Lite pytest-dev__pytest-8365",
  "prompt": "tmpdir creation fails when the username contains illegal characters for directory names\n`tmpdir`, `tmpdir_factory` and `tmp_path_factory` rely on `getpass.getuser()` for determining the `basetemp` directory. I found that the user name returned by `getpass.getuser()` may return characters that are not allowed for directory names. This may lead to errors while creating the temporary directory.\r\n\r\nThe situation in which I reproduced this issue was while being logged in through an ssh connection into my Windows 10 x64 Enterprise version (1909) using an OpenSSH_for_Windows_7.7p1 server. In this configuration the command `python -c \"import getpass; print(getpass.getuser())\"` returns my domain username e.g. `contoso\\john_doe` instead of `john_doe` as when logged in regularly using a local session.\r\n\r\nWhen trying to create a temp directory in pytest through e.g. `tmpdir_factory.mktemp('foobar')` this fails with the following error message:\r\n```\r\nself = WindowsPath('C:/Users/john_doe/AppData/Local/Temp/pytest-of-contoso/john_doe')\r\nmode = 511, parents = False, exist_ok = True\r\n\r\n    def mkdir(self, mode=0o777, parents=False, exist_ok=False):\r\n        \"\"\"\r\n        Create a new directory at this given path.\r\n        \"\"\"\r\n        if self._closed:\r\n            self._raise_closed()\r\n        try:\r\n>           self._accessor.mkdir(self, mode)\r\nE           FileNotFoundError: [WinError 3] The system cannot find the path specified: 'C:\\\\Users\\\\john_doe\\\\AppData\\\\Local\\\\Temp\\\\pytest-of-contoso\\\\john_doe'\r\n\r\nC:\\Python38\\lib\\pathlib.py:1266: FileNotFoundError\r\n```\r\n\r\nI could also reproduce this without the complicated ssh/windows setup with pytest 6.2.2 using the following commands from a `cmd`:\r\n```bat\r\necho def test_tmpdir(tmpdir):>test_tmp.py\r\necho   pass>>test_tmp.py\r\nset LOGNAME=contoso\\john_doe\r\npy.test test_tmp.py\r\n```\r\n\r\nThanks for having a look at this!",
  "source": {
    "git": "https://github.com/pytest-dev/pytest.git",
    "revision": "4964b468c83c06971eb743fbc57cc404f760c573"
  },
  "baseline_patch": "diff --git a/testing/test_tmpdir.py b/testing/test_tmpdir.py\n--- a/testing/test_tmpdir.py\n+++ b/testing/test_tmpdir.py\n@@ -11,6 +11,7 @@\n import pytest\n from _pytest import pathlib\n from _pytest.config import Config\n+from _pytest.monkeypatch import MonkeyPatch\n from _pytest.pathlib import cleanup_numbered_dir\n from _pytest.pathlib import create_cleanup_lock\n from _pytest.pathlib import make_numbered_dir\n@@ -445,3 +446,14 @@ def test(tmp_path):\n     # running a second time and ensure we don't crash\n     result = pytester.runpytest(\"--basetemp=tmp\")\n     assert result.ret == 0\n+\n+\n+def test_tmp_path_factory_handles_invalid_dir_characters(\n+    tmp_path_factory: TempPathFactory, monkeypatch: MonkeyPatch\n+) -> None:\n+    monkeypatch.setattr(\"getpass.getuser\", lambda: \"os/<:*?;>agnostic\")\n+    # _basetemp / _given_basetemp are cached / set in parallel runs, patch them\n+    monkeypatch.setattr(tmp_path_factory, \"_basetemp\", None)\n+    monkeypatch.setattr(tmp_path_factory, \"_given_basetemp\", None)\n+    p = tmp_path_factory.getbasetemp()\n+    assert \"pytest-of-unknown\" in str(p)\n",
  "env": {
    "PYTHONUTF8": "1",
    "PYTHONIOENCODING": "utf-8",
    "PYTHONDONTWRITEBYTECODE": "1"
  },
  "setup": [
    {
      "name": "install pinned repository",
      "argv": [
        "python",
        "-m",
        "pip",
        "install",
        "-e",
        "."
      ],
      "timeout_seconds": 1200
    }
  ],
  "baseline": [
    {
      "name": "prove SWE-bench regression",
      "argv": [
        "python",
        "-m",
        "pytest",
        "-q",
        "testing/test_tmpdir.py::test_tmp_path_factory_handles_invalid_dir_characters"
      ],
      "timeout_seconds": 900
    }
  ],
  "judges": [
    {
      "name": "SWE-bench FAIL_TO_PASS",
      "argv": [
        "python",
        "-m",
        "pytest",
        "-q",
        "testing/test_tmpdir.py::test_tmp_path_factory_handles_invalid_dir_characters"
      ],
      "timeout_seconds": 900
    },
    {
      "name": "SWE-bench PASS_TO_PASS regression sample",
      "argv": [
        "python",
        "-m",
        "pytest",
        "-q",
        "testing/test_tmpdir.py::TestTempdirHandler::test_mktemp",
        "testing/test_tmpdir.py::TestTempdirHandler::test_tmppath_relative_basetemp_absolute",
        "testing/test_tmpdir.py::test_get_user_uid_not_found",
        "testing/test_tmpdir.py::TestNumberedDir::test_make",
        "testing/test_tmpdir.py::TestNumberedDir::test_cleanup_lock_create",
        "testing/test_tmpdir.py::TestNumberedDir::test_lock_register_cleanup_removal",
        "testing/test_tmpdir.py::TestNumberedDir::test_cleanup_keep",
        "testing/test_tmpdir.py::TestNumberedDir::test_cleanup_locked",
        "testing/test_tmpdir.py::TestNumberedDir::test_cleanup_ignores_symlink",
        "testing/test_tmpdir.py::TestNumberedDir::test_removal_accepts_lock",
        "testing/test_tmpdir.py::TestRmRf::test_rm_rf",
        "testing/test_tmpdir.py::TestRmRf::test_rm_rf_with_read_only_file",
        "testing/test_tmpdir.py::TestRmRf::test_rm_rf_with_read_only_directory",
        "testing/test_tmpdir.py::TestRmRf::test_on_rm_rf_error",
        "testing/test_tmpdir.py::test_tmpdir_equals_tmp_path",
        "testing/test_tmpdir.py::test_tmpdir_fixture",
        "testing/test_tmpdir.py::TestConfigTmpdir::test_getbasetemp_custom_removes_old",
        "testing/test_tmpdir.py::test_mktemp",
        "testing/test_tmpdir.py::test_tmpdir_always_is_realpath",
        "testing/test_tmpdir.py::test_tmp_path_always_is_realpath"
      ],
      "timeout_seconds": 1200
    }
  ],
  "forbidden_changes": [
    "testing/test_tmpdir.py"
  ],
  "agent_verify_command": "python -m pytest -q testing/test_tmpdir.py::test_tmp_path_factory_handles_invalid_dir_characters",
  "agent_verify_timeout_seconds": 900,
  "agent_timeout_seconds": 2400,
  "seeds": [
    11,
    29,
    47
  ],
  "minimum_pass_rate": 0.6666666666666666,
  "tags": [
    "swe-bench-lite",
    "real-repository",
    "pytest-dev/pytest",
    "fixed-revision"
  ]
}
