{
  "id": "pytest-dev-pytest-7373",
  "title": "SWE-bench Lite pytest-dev__pytest-7373",
  "prompt": "Incorrect caching of skipif/xfail string condition evaluation\nVersion: pytest 5.4.3, current master\r\n\r\npytest caches the evaluation of the string in e.g. `@pytest.mark.skipif(\"sys.platform == 'win32'\")`. The caching key is only the string itself (see `cached_eval` in `_pytest/mark/evaluate.py`). However, the evaluation also depends on the item's globals, so the caching can lead to incorrect results. Example:\r\n\r\n```py\r\n# test_module_1.py\r\nimport pytest\r\n\r\nskip = True\r\n\r\n@pytest.mark.skipif(\"skip\")\r\ndef test_should_skip():\r\n    assert False\r\n```\r\n\r\n```py\r\n# test_module_2.py\r\nimport pytest\r\n\r\nskip = False\r\n\r\n@pytest.mark.skipif(\"skip\")\r\ndef test_should_not_skip():\r\n    assert False\r\n```\r\n\r\nRunning `pytest test_module_1.py test_module_2.py`.\r\n\r\nExpected: `test_should_skip` is skipped, `test_should_not_skip` is not skipped.\r\n\r\nActual: both are skipped.\r\n\r\n---\r\n\r\nI think the most appropriate fix is to simply remove the caching, which I don't think is necessary really, and inline `cached_eval` into `MarkEvaluator._istrue`.",
  "source": {
    "git": "https://github.com/pytest-dev/pytest.git",
    "revision": "7b77fc086aab8b3a8ebc890200371884555eea1e"
  },
  "baseline_patch": "diff --git a/testing/test_mark.py b/testing/test_mark.py\n--- a/testing/test_mark.py\n+++ b/testing/test_mark.py\n@@ -706,6 +706,36 @@ def test_1(parameter):\n         reprec = testdir.inline_run()\n         reprec.assertoutcome(skipped=1)\n \n+    def test_reevaluate_dynamic_expr(self, testdir):\n+        \"\"\"#7360\"\"\"\n+        py_file1 = testdir.makepyfile(\n+            test_reevaluate_dynamic_expr1=\"\"\"\n+            import pytest\n+\n+            skip = True\n+\n+            @pytest.mark.skipif(\"skip\")\n+            def test_should_skip():\n+                assert True\n+        \"\"\"\n+        )\n+        py_file2 = testdir.makepyfile(\n+            test_reevaluate_dynamic_expr2=\"\"\"\n+            import pytest\n+\n+            skip = False\n+\n+            @pytest.mark.skipif(\"skip\")\n+            def test_should_not_skip():\n+                assert True\n+        \"\"\"\n+        )\n+\n+        file_name1 = os.path.basename(py_file1.strpath)\n+        file_name2 = os.path.basename(py_file2.strpath)\n+        reprec = testdir.inline_run(file_name1, file_name2)\n+        reprec.assertoutcome(passed=1, skipped=1)\n+\n \n class TestKeywordSelection:\n     def test_select_simple(self, testdir):\n",
  "env": {
    "PYTHONUTF8": "1",
    "PYTHONIOENCODING": "utf-8",
    "PYTHONDONTWRITEBYTECODE": "1"
  },
  "setup": [
    {
      "name": "install pinned repository",
      "argv": [
        "python",
        "-m",
        "pip",
        "install",
        "-e",
        "."
      ],
      "timeout_seconds": 1200
    }
  ],
  "baseline": [
    {
      "name": "prove SWE-bench regression",
      "argv": [
        "python",
        "-m",
        "pytest",
        "-q",
        "testing/test_mark.py::TestFunctional::test_reevaluate_dynamic_expr"
      ],
      "timeout_seconds": 900
    }
  ],
  "judges": [
    {
      "name": "SWE-bench FAIL_TO_PASS",
      "argv": [
        "python",
        "-m",
        "pytest",
        "-q",
        "testing/test_mark.py::TestFunctional::test_reevaluate_dynamic_expr"
      ],
      "timeout_seconds": 900
    },
    {
      "name": "SWE-bench PASS_TO_PASS regression sample",
      "argv": [
        "python",
        "-m",
        "pytest",
        "-q",
        "testing/test_mark.py::TestMark::test_pytest_exists_in_namespace_all",
        "testing/test_mark.py::TestMark::test_pytest_mark_notcallable",
        "testing/test_mark.py::TestMark::test_mark_with_param",
        "testing/test_mark.py::TestMark::test_pytest_mark_name_starts_with_underscore",
        "testing/test_mark.py::TestMarkDecorator::test__eq__",
        "testing/test_mark.py::TestMarkDecorator::test_aliases",
        "testing/test_mark.py::test_addmarker_order",
        "testing/test_mark.py::test_pytest_param_id_requires_string",
        "testing/test_mark.py::test_pytest_param_id_allows_none_or_string",
        "testing/test_mark.py::test_marked_class_run_twice",
        "testing/test_mark.py::test_ini_markers",
        "testing/test_mark.py::test_markers_option",
        "testing/test_mark.py::test_ini_markers_whitespace",
        "testing/test_mark.py::test_marker_without_description",
        "testing/test_mark.py::test_markers_option_with_plugin_in_current_dir",
        "testing/test_mark.py::test_mark_on_pseudo_function",
        "testing/test_mark.py::test_strict_prohibits_unregistered_markers",
        "testing/test_mark.py::test_mark_option",
        "testing/test_mark.py::test_mark_option_custom",
        "testing/test_mark.py::test_keyword_option_custom"
      ],
      "timeout_seconds": 1200
    }
  ],
  "forbidden_changes": [
    "testing/test_mark.py"
  ],
  "agent_verify_command": "python -m pytest -q testing/test_mark.py::TestFunctional::test_reevaluate_dynamic_expr",
  "agent_verify_timeout_seconds": 900,
  "agent_timeout_seconds": 2400,
  "seeds": [
    11,
    29,
    47
  ],
  "minimum_pass_rate": 0.6666666666666666,
  "tags": [
    "swe-bench-lite",
    "real-repository",
    "pytest-dev/pytest",
    "fixed-revision"
  ]
}
