{
  "id": "pytest-dev-pytest-8906",
  "title": "SWE-bench Lite pytest-dev__pytest-8906",
  "prompt": "Improve handling of skip for module level\nThis is potentially about updating docs, updating error messages or introducing a new API.\r\n\r\nConsider the following scenario:\r\n\r\n`pos_only.py` is using Python 3,8 syntax:\r\n```python\r\ndef foo(a, /, b):\r\n    return a + b\r\n```\r\n\r\nIt should not be tested under Python 3.6 and 3.7.\r\nThis is a proper way to skip the test in Python older than 3.8:\r\n```python\r\nfrom pytest import raises, skip\r\nimport sys\r\nif sys.version_info < (3, 8):\r\n    skip(msg=\"Requires Python >= 3.8\", allow_module_level=True)\r\n\r\n# import must be after the module level skip:\r\nfrom pos_only import *\r\n\r\ndef test_foo():\r\n    assert foo(10, 20) == 30\r\n    assert foo(10, b=20) == 30\r\n    with raises(TypeError):\r\n        assert foo(a=10, b=20)\r\n```\r\n\r\nMy actual test involves parameterize and a 3.8 only class, so skipping the test itself is not sufficient because the 3.8 class was used in the parameterization.\r\n\r\nA naive user will try to initially skip the module like:\r\n\r\n```python\r\nif sys.version_info < (3, 8):\r\n    skip(msg=\"Requires Python >= 3.8\")\r\n```\r\nThis issues this error:\r\n\r\n>Using pytest.skip outside of a test is not allowed. To decorate a test function, use the @pytest.mark.skip or @pytest.mark.skipif decorators instead, and to skip a module use `pytestmark = pytest.mark.{skip,skipif}.\r\n\r\nThe proposed solution `pytestmark = pytest.mark.{skip,skipif}`, does not work  in my case: pytest continues to process the file and fail when it hits the 3.8 syntax (when running with an older version of Python).\r\n\r\nThe correct solution, to use skip as a function is actively discouraged by the error message.\r\n\r\nThis area feels a bit unpolished.\r\nA few ideas to improve:\r\n\r\n1. Explain skip with  `allow_module_level` in the error message. this seems in conflict with the spirit of the message.\r\n2. Create an alternative API to skip a module to make things easier: `skip_module(\"reason\")`, which can call `_skip(msg=msg, allow_module_level=True)`.",
  "source": {
    "git": "https://github.com/pytest-dev/pytest.git",
    "revision": "69356d20cfee9a81972dcbf93d8caf9eabe113e8"
  },
  "baseline_patch": "diff --git a/testing/test_skipping.py b/testing/test_skipping.py\n--- a/testing/test_skipping.py\n+++ b/testing/test_skipping.py\n@@ -1341,7 +1341,7 @@ def test_func():\n     )\n     result = pytester.runpytest()\n     result.stdout.fnmatch_lines(\n-        [\"*Using pytest.skip outside of a test is not allowed*\"]\n+        [\"*Using pytest.skip outside of a test will skip the entire module*\"]\n     )\n \n \n",
  "env": {
    "PYTHONUTF8": "1",
    "PYTHONIOENCODING": "utf-8",
    "PYTHONDONTWRITEBYTECODE": "1"
  },
  "setup": [
    {
      "name": "install pinned repository",
      "argv": [
        "python",
        "-m",
        "pip",
        "install",
        "-e",
        "."
      ],
      "timeout_seconds": 1200
    }
  ],
  "baseline": [
    {
      "name": "prove SWE-bench regression",
      "argv": [
        "python",
        "-m",
        "pytest",
        "-q",
        "testing/test_skipping.py::test_module_level_skip_error"
      ],
      "timeout_seconds": 900
    }
  ],
  "judges": [
    {
      "name": "SWE-bench FAIL_TO_PASS",
      "argv": [
        "python",
        "-m",
        "pytest",
        "-q",
        "testing/test_skipping.py::test_module_level_skip_error"
      ],
      "timeout_seconds": 900
    },
    {
      "name": "SWE-bench PASS_TO_PASS regression sample",
      "argv": [
        "python",
        "-m",
        "pytest",
        "-q",
        "testing/test_skipping.py::test_importorskip",
        "testing/test_skipping.py::TestEvaluation::test_no_marker",
        "testing/test_skipping.py::TestEvaluation::test_marked_xfail_no_args",
        "testing/test_skipping.py::TestEvaluation::test_marked_skipif_no_args",
        "testing/test_skipping.py::TestEvaluation::test_marked_one_arg",
        "testing/test_skipping.py::TestEvaluation::test_marked_one_arg_with_reason",
        "testing/test_skipping.py::TestEvaluation::test_marked_one_arg_twice",
        "testing/test_skipping.py::TestEvaluation::test_marked_one_arg_twice2",
        "testing/test_skipping.py::TestEvaluation::test_marked_skipif_with_boolean_without_reason",
        "testing/test_skipping.py::TestEvaluation::test_marked_skipif_with_invalid_boolean",
        "testing/test_skipping.py::TestEvaluation::test_skipif_class",
        "testing/test_skipping.py::TestEvaluation::test_skipif_markeval_namespace",
        "testing/test_skipping.py::TestEvaluation::test_skipif_markeval_namespace_multiple",
        "testing/test_skipping.py::TestEvaluation::test_skipif_markeval_namespace_ValueError",
        "testing/test_skipping.py::TestXFail::test_xfail_simple",
        "testing/test_skipping.py::TestXFail::test_xfail_xpassed",
        "testing/test_skipping.py::TestXFail::test_xfail_using_platform",
        "testing/test_skipping.py::TestXFail::test_xfail_xpassed_strict",
        "testing/test_skipping.py::TestXFail::test_xfail_run_anyway",
        "testing/test_skipping.py::TestXFail::test_xfail_run_with_skip_mark"
      ],
      "timeout_seconds": 1200
    }
  ],
  "forbidden_changes": [
    "testing/test_skipping.py"
  ],
  "agent_verify_command": "python -m pytest -q testing/test_skipping.py::test_module_level_skip_error",
  "agent_verify_timeout_seconds": 900,
  "agent_timeout_seconds": 2400,
  "seeds": [
    11,
    29,
    47
  ],
  "minimum_pass_rate": 0.6666666666666666,
  "tags": [
    "swe-bench-lite",
    "real-repository",
    "pytest-dev/pytest",
    "fixed-revision"
  ]
}
