{
  "id": "pytest-dev-pytest-7432",
  "title": "SWE-bench Lite pytest-dev__pytest-7432",
  "prompt": "skipping: --runxfail breaks pytest.mark.skip location reporting\npytest versions: 5.4.x, current master\r\n\r\nWhen `@pytest.mark.skip`/`skipif` marks are used to skip a test, for example\r\n\r\n```py\r\nimport pytest\r\n@pytest.mark.skip\r\ndef test_skip_location() -> None:\r\n    assert 0\r\n```\r\n\r\nthe expected skip location reported should point to the item itself, and this is indeed what happens when running with `pytest -rs`:\r\n\r\n```\r\nSKIPPED [1] test_it.py:3: unconditional skip\r\n```\r\n\r\nHowever, adding `pytest -rs --runxfail` breaks this:\r\n\r\n```\r\nSKIPPED [1] src/_pytest/skipping.py:238: unconditional skip\r\n```\r\n\r\nThe `--runxfail` is only about xfail and should not affect this at all.\r\n\r\n---\r\n\r\nHint: the bug is in `src/_pytest/skipping.py`, the `pytest_runtest_makereport` hook.",
  "source": {
    "git": "https://github.com/pytest-dev/pytest.git",
    "revision": "e6e300e729dd33956e5448d8be9a0b1540b4e53a"
  },
  "baseline_patch": "diff --git a/testing/test_skipping.py b/testing/test_skipping.py\n--- a/testing/test_skipping.py\n+++ b/testing/test_skipping.py\n@@ -235,6 +235,31 @@ def test_func2():\n             [\"*def test_func():*\", \"*assert 0*\", \"*1 failed*1 pass*\"]\n         )\n \n+    @pytest.mark.parametrize(\n+        \"test_input,expected\",\n+        [\n+            (\n+                [\"-rs\"],\n+                [\"SKIPPED [1] test_sample.py:2: unconditional skip\", \"*1 skipped*\"],\n+            ),\n+            (\n+                [\"-rs\", \"--runxfail\"],\n+                [\"SKIPPED [1] test_sample.py:2: unconditional skip\", \"*1 skipped*\"],\n+            ),\n+        ],\n+    )\n+    def test_xfail_run_with_skip_mark(self, testdir, test_input, expected):\n+        testdir.makepyfile(\n+            test_sample=\"\"\"\n+            import pytest\n+            @pytest.mark.skip\n+            def test_skip_location() -> None:\n+                assert 0\n+        \"\"\"\n+        )\n+        result = testdir.runpytest(*test_input)\n+        result.stdout.fnmatch_lines(expected)\n+\n     def test_xfail_evalfalse_but_fails(self, testdir):\n         item = testdir.getitem(\n             \"\"\"\n",
  "env": {
    "PYTHONUTF8": "1",
    "PYTHONIOENCODING": "utf-8",
    "PYTHONDONTWRITEBYTECODE": "1"
  },
  "setup": [
    {
      "name": "install pinned repository",
      "argv": [
        "python",
        "-m",
        "pip",
        "install",
        "-e",
        "."
      ],
      "timeout_seconds": 1200
    }
  ],
  "baseline": [
    {
      "name": "prove SWE-bench regression",
      "argv": [
        "python",
        "-m",
        "pytest",
        "-q",
        "testing/test_skipping.py::TestXFail::test_xfail_run_with_skip_mark"
      ],
      "timeout_seconds": 900
    }
  ],
  "judges": [
    {
      "name": "SWE-bench FAIL_TO_PASS",
      "argv": [
        "python",
        "-m",
        "pytest",
        "-q",
        "testing/test_skipping.py::TestXFail::test_xfail_run_with_skip_mark"
      ],
      "timeout_seconds": 900
    },
    {
      "name": "SWE-bench PASS_TO_PASS regression sample",
      "argv": [
        "python",
        "-m",
        "pytest",
        "-q",
        "testing/test_skipping.py::test_importorskip",
        "testing/test_skipping.py::TestEvaluation::test_no_marker",
        "testing/test_skipping.py::TestEvaluation::test_marked_xfail_no_args",
        "testing/test_skipping.py::TestEvaluation::test_marked_skipif_no_args",
        "testing/test_skipping.py::TestEvaluation::test_marked_one_arg",
        "testing/test_skipping.py::TestEvaluation::test_marked_one_arg_with_reason",
        "testing/test_skipping.py::TestEvaluation::test_marked_one_arg_twice",
        "testing/test_skipping.py::TestEvaluation::test_marked_one_arg_twice2",
        "testing/test_skipping.py::TestEvaluation::test_marked_skipif_with_boolean_without_reason",
        "testing/test_skipping.py::TestEvaluation::test_marked_skipif_with_invalid_boolean",
        "testing/test_skipping.py::TestEvaluation::test_skipif_class",
        "testing/test_skipping.py::TestXFail::test_xfail_simple",
        "testing/test_skipping.py::TestXFail::test_xfail_xpassed",
        "testing/test_skipping.py::TestXFail::test_xfail_using_platform",
        "testing/test_skipping.py::TestXFail::test_xfail_xpassed_strict",
        "testing/test_skipping.py::TestXFail::test_xfail_run_anyway",
        "testing/test_skipping.py::TestXFail::test_xfail_run_with_skip_mark",
        "testing/test_skipping.py::TestXFail::test_xfail_evalfalse_but_fails",
        "testing/test_skipping.py::TestXFail::test_xfail_not_report_default",
        "testing/test_skipping.py::TestXFail::test_xfail_not_run_xfail_reporting"
      ],
      "timeout_seconds": 1200
    }
  ],
  "forbidden_changes": [
    "testing/test_skipping.py"
  ],
  "agent_verify_command": "python -m pytest -q testing/test_skipping.py::TestXFail::test_xfail_run_with_skip_mark",
  "agent_verify_timeout_seconds": 900,
  "agent_timeout_seconds": 2400,
  "seeds": [
    11,
    29,
    47
  ],
  "minimum_pass_rate": 0.6666666666666666,
  "tags": [
    "swe-bench-lite",
    "real-repository",
    "pytest-dev/pytest",
    "fixed-revision"
  ]
}
