{
  "id": "pytest-dev-pytest-11143",
  "title": "SWE-bench Lite pytest-dev__pytest-11143",
  "prompt": "Rewrite fails when first expression of file is a number and mistaken as docstring \n<!--\r\nThanks for submitting an issue!\r\n\r\nQuick check-list while reporting bugs:\r\n-->\r\n\r\n- [x] a detailed description of the bug or problem you are having\r\n- [x] output of `pip list` from the virtual environment you are using\r\n- [x] pytest and operating system versions\r\n- [x] minimal example if possible\r\n```\r\nInstalling collected packages: zipp, six, PyYAML, python-dateutil, MarkupSafe, importlib-metadata, watchdog, tomli, soupsieve, pyyaml-env-tag, pycparser, pluggy, packaging, mergedeep, Markdown, jinja2, iniconfig, ghp-import, exceptiongroup, click, websockets, urllib3, tqdm, smmap, pytest, pyee, mkdocs, lxml, importlib-resources, idna, cssselect, charset-normalizer, cffi, certifi, beautifulsoup4, attrs, appdirs, w3lib, typing-extensions, texttable, requests, pyzstd, pytest-metadata, pyquery, pyppmd, pyppeteer, pynacl, pymdown-extensions, pycryptodomex, pybcj, pyasn1, py, psutil, parse, multivolumefile, mkdocs-autorefs, inflate64, gitdb, fake-useragent, cryptography, comtypes, bs4, brotli, bcrypt, allure-python-commons, xlwt, xlrd, rsa, requests-html, pywinauto, python-i18n, python-dotenv, pytest-rerunfailures, pytest-html, pytest-check, PySocks, py7zr, paramiko, mkdocstrings, loguru, GitPython, ftputil, crcmod, chardet, brotlicffi, allure-pytest\r\nSuccessfully installed GitPython-3.1.31 Markdown-3.3.7 MarkupSafe-2.1.3 PySocks-1.7.1 PyYAML-6.0 allure-pytest-2.13.2 allure-python-commons-2.13.2 appdirs-1.4.4 attrs-23.1.0 bcrypt-4.0.1 beautifulsoup4-4.12.2 brotli-1.0.9 brotlicffi-1.0.9.2 bs4-0.0.1 certifi-2023.5.7 cffi-1.15.1 chardet-5.1.0 charset-normalizer-3.1.0 click-8.1.3 comtypes-1.2.0 crcmod-1.7 cryptography-41.0.1 cssselect-1.2.0 exceptiongroup-1.1.1 fake-useragent-1.1.3 ftputil-5.0.4 ghp-import-2.1.0 gitdb-4.0.10 idna-3.4 importlib-metadata-6.7.0 importlib-resources-5.12.0 inflate64-0.3.1 iniconfig-2.0.0 jinja2-3.1.2 loguru-0.7.0 lxml-4.9.2 mergedeep-1.3.4 mkdocs-1.4.3 mkdocs-autorefs-0.4.1 mkdocstrings-0.22.0 multivolumefile-0.2.3 packaging-23.1 paramiko-3.2.0 parse-1.19.1 pluggy-1.2.0 psutil-5.9.5 py-1.11.0 py7zr-0.20.5 pyasn1-0.5.0 pybcj-1.0.1 pycparser-2.21 pycryptodomex-3.18.0 pyee-8.2.2 pymdown-extensions-10.0.1 pynacl-1.5.0 pyppeteer-1.0.2 pyppmd-1.0.0 pyquery-2.0.0 pytest-7.4.0 pytest-check-2.1.5 pytest-html-3.2.0 pytest-metadata-3.0.0 pytest-rerunfailures-11.1.2 python-dateutil-2.8.2 python-dotenv-1.0.0 python-i18n-0.3.9 pywinauto-0.6.6 pyyaml-env-tag-0.1 pyzstd-0.15.9 requests-2.31.0 requests-html-0.10.0 rsa-4.9 six-1.16.0 smmap-5.0.0 soupsieve-2.4.1 texttable-1.6.7 tomli-2.0.1 tqdm-4.65.0 typing-extensions-4.6.3 urllib3-1.26.16 w3lib-2.1.1 watchdog-3.0.0 websockets-10.4 xlrd-2.0.1 xlwt-1.3.0 zipp-3.15.0\r\n```\r\nuse `pytest -k xxx`， report an error：`TypeError: argument of type 'int' is not iterable`\r\n\r\nit seems a error in collecting testcase\r\n```\r\n==================================== ERRORS ====================================\r\n_ ERROR collecting testcases/基线/代理策略/SOCKS二级代理迭代二/在线用户/在线用户更新/上线用户/test_socks_user_011.py _\r\n/usr/local/lib/python3.8/site-packages/_pytest/runner.py:341: in from_call\r\n    result: Optional[TResult] = func()\r\n/usr/local/lib/python3.8/site-packages/_pytest/runner.py:372: in <lambda>\r\n    call = CallInfo.from_call(lambda: list(collector.collect()), \"collect\")\r\n/usr/local/lib/python3.8/site-packages/_pytest/python.py:531: in collect\r\n    self._inject_setup_module_fixture()\r\n/usr/local/lib/python3.8/site-packages/_pytest/python.py:545: in _inject_setup_module_fixture\r\n    self.obj, (\"setUpModule\", \"setup_module\")\r\n/usr/local/lib/python3.8/site-packages/_pytest/python.py:310: in obj\r\n    self._obj = obj = self._getobj()\r\n/usr/local/lib/python3.8/site-packages/_pytest/python.py:528: in _getobj\r\n    return self._importtestmodule()\r\n/usr/local/lib/python3.8/site-packages/_pytest/python.py:617: in _importtestmodule\r\n    mod = import_path(self.path, mode=importmode, root=self.config.rootpath)\r\n/usr/local/lib/python3.8/site-packages/_pytest/pathlib.py:565: in import_path\r\n    importlib.import_module(module_name)\r\n/usr/local/lib/python3.8/importlib/__init__.py:127: in import_module\r\n    return _bootstrap._gcd_import(name[level:], package, level)\r\n<frozen importlib._bootstrap>:1014: in _gcd_import\r\n    ???\r\n<frozen importlib._bootstrap>:991: in _find_and_load\r\n    ???\r\n<frozen importlib._bootstrap>:975: in _find_and_load_unlocked\r\n    ???\r\n<frozen importlib._bootstrap>:671: in _load_unlocked\r\n    ???\r\n/usr/local/lib/python3.8/site-packages/_pytest/assertion/rewrite.py:169: in exec_module\r\n    source_stat, co = _rewrite_test(fn, self.config)\r\n/usr/local/lib/python3.8/site-packages/_pytest/assertion/rewrite.py:352: in _rewrite_test\r\n    rewrite_asserts(tree, source, strfn, config)\r\n/usr/local/lib/python3.8/site-packages/_pytest/assertion/rewrite.py:413: in rewrite_asserts\r\n    AssertionRewriter(module_path, config, source).run(mod)\r\n/usr/local/lib/python3.8/site-packages/_pytest/assertion/rewrite.py:695: in run\r\n    if self.is_rewrite_disabled(doc):\r\n/usr/local/lib/python3.8/site-packages/_pytest/assertion/rewrite.py:760: in is_rewrite_disabled\r\n    return \"PYTEST_DONT_REWRITE\" in docstring\r\nE   TypeError: argument of type 'int' is not iterable\r\n```",
  "source": {
    "git": "https://github.com/pytest-dev/pytest.git",
    "revision": "6995257cf470d2143ad1683824962de4071c0eb7"
  },
  "baseline_patch": "diff --git a/testing/test_assertrewrite.py b/testing/test_assertrewrite.py\n--- a/testing/test_assertrewrite.py\n+++ b/testing/test_assertrewrite.py\n@@ -2042,3 +2042,17 @@ def test_max_increased_verbosity(self, pytester: Pytester) -> None:\n         self.create_test_file(pytester, DEFAULT_REPR_MAX_SIZE * 10)\n         result = pytester.runpytest(\"-vv\")\n         result.stdout.no_fnmatch_line(\"*xxx...xxx*\")\n+\n+\n+class TestIssue11140:\n+    def test_constant_not_picked_as_module_docstring(self, pytester: Pytester) -> None:\n+        pytester.makepyfile(\n+            \"\"\"\\\n+            0\n+\n+            def test_foo():\n+                pass\n+            \"\"\"\n+        )\n+        result = pytester.runpytest()\n+        assert result.ret == 0\n",
  "env": {
    "PYTHONUTF8": "1",
    "PYTHONIOENCODING": "utf-8",
    "PYTHONDONTWRITEBYTECODE": "1"
  },
  "setup": [
    {
      "name": "install pinned repository",
      "argv": [
        "python",
        "-m",
        "pip",
        "install",
        "-e",
        "."
      ],
      "timeout_seconds": 1200
    }
  ],
  "baseline": [
    {
      "name": "prove SWE-bench regression",
      "argv": [
        "python",
        "-m",
        "pytest",
        "-q",
        "testing/test_assertrewrite.py::TestIssue11140::test_constant_not_picked_as_module_docstring"
      ],
      "timeout_seconds": 900
    }
  ],
  "judges": [
    {
      "name": "SWE-bench FAIL_TO_PASS",
      "argv": [
        "python",
        "-m",
        "pytest",
        "-q",
        "testing/test_assertrewrite.py::TestIssue11140::test_constant_not_picked_as_module_docstring"
      ],
      "timeout_seconds": 900
    },
    {
      "name": "SWE-bench PASS_TO_PASS regression sample",
      "argv": [
        "python",
        "-m",
        "pytest",
        "-q",
        "testing/test_assertrewrite.py::TestAssertionRewrite::test_place_initial_imports",
        "testing/test_assertrewrite.py::TestAssertionRewrite::test_location_is_set",
        "testing/test_assertrewrite.py::TestAssertionRewrite::test_dont_rewrite",
        "testing/test_assertrewrite.py::TestAssertionRewrite::test_name",
        "testing/test_assertrewrite.py::TestAssertionRewrite::test_assertrepr_compare_same_width",
        "testing/test_assertrewrite.py::TestAssertionRewrite::test_dont_rewrite_if_hasattr_fails",
        "testing/test_assertrewrite.py::TestAssertionRewrite::test_assert_already_has_message",
        "testing/test_assertrewrite.py::TestAssertionRewrite::test_boolop",
        "testing/test_assertrewrite.py::TestAssertionRewrite::test_short_circuit_evaluation",
        "testing/test_assertrewrite.py::TestAssertionRewrite::test_unary_op",
        "testing/test_assertrewrite.py::TestAssertionRewrite::test_binary_op",
        "testing/test_assertrewrite.py::TestAssertionRewrite::test_boolop_percent",
        "testing/test_assertrewrite.py::TestAssertionRewrite::test_call",
        "testing/test_assertrewrite.py::TestAssertionRewrite::test_attribute",
        "testing/test_assertrewrite.py::TestAssertionRewrite::test_comparisons",
        "testing/test_assertrewrite.py::TestAssertionRewrite::test_len",
        "testing/test_assertrewrite.py::TestAssertionRewrite::test_custom_reprcompare",
        "testing/test_assertrewrite.py::TestAssertionRewrite::test_assert_raising__bool__in_comparison",
        "testing/test_assertrewrite.py::TestAssertionRewrite::test_formatchar",
        "testing/test_assertrewrite.py::TestAssertionRewrite::test_custom_repr"
      ],
      "timeout_seconds": 1200
    }
  ],
  "forbidden_changes": [
    "testing/test_assertrewrite.py"
  ],
  "agent_verify_command": "python -m pytest -q testing/test_assertrewrite.py::TestIssue11140::test_constant_not_picked_as_module_docstring",
  "agent_verify_timeout_seconds": 900,
  "agent_timeout_seconds": 2400,
  "seeds": [
    11,
    29,
    47
  ],
  "minimum_pass_rate": 0.6666666666666666,
  "tags": [
    "swe-bench-lite",
    "real-repository",
    "pytest-dev/pytest",
    "fixed-revision"
  ]
}
